{
  "$schema": "../../donation_language_v1.1.json",
  "schema_version": "1.1",
  "handler_domain": "random",
  "language": "en",
  "description": "Random number generation, coin flips, dice rolls, and random choices",
  "action_patterns": [
    "flip",
    "roll",
    "generate",
    "choose"
  ],
  "negative_patterns": [
    [
      {
        "LEMMA": {
          "IN": []
        }
      },
      {
        "LEMMA": {
          "IN": []
        }
      }
    ],
    [
      {
        "TEXT": {
          "REGEX": "no|not"
        }
      },
      {
        "TEXT": {
          "REGEX": "random|coin|dice"
        }
      }
    ]
  ],
  "method_donations": [
    {
      "method_name": "_handle_coin_flip",
      "intent_suffix": "coin_flip",
      "description": "Flip a coin and get heads or tails result",
      "phrases": [
        "flip coin",
        "coin flip",
        "toss coin",
        "heads or tails"
      ],
      "lemmas": [],
      "token_patterns": [
        [
          {
            "TEXT": {
              "REGEX": "flip|toss"
            }
          },
          {
            "TEXT": "coin"
          }
        ],
        [
          {
            "TEXT": "coin"
          },
          {
            "TEXT": "flip"
          }
        ],
        [
          {
            "TEXT": "heads"
          },
          {
            "TEXT": "or"
          },
          {
            "TEXT": "tails"
          }
        ]
      ],
      "examples": [
        {
          "text": "flip coin",
          "parameters": {}
        }
      ]
    },
    {
      "method_name": "_handle_dice_roll",
      "intent_suffix": "dice_roll",
      "description": "Roll dice with specified sides and count",
      "phrases": [
        "roll dice",
        "dice roll",
        "throw dice"
      ],
      "lemmas": [],
      "token_patterns": [
        [
          {
            "TEXT": {
              "REGEX": "roll|throw"
            }
          },
          {
            "TEXT": "dice"
          }
        ],
        [
          {
            "TEXT": "dice"
          },
          {
            "TEXT": "roll"
          }
        ]
      ],
      "slot_patterns": {
        "DICE_SIDES": [
          [
            {
              "LIKE_NUM": true
            },
            {
              "LOWER": {
                "IN": [
                  "sided",
                  "sides"
                ]
              }
            }
          ]
        ],
        "DICE_COUNT": [
          [
            {
              "LIKE_NUM": true
            },
            {
              "LEMMA": {
                "IN": [
                  "dice"
                ]
              }
            }
          ]
        ]
      },
      "examples": [
        {
          "text": "roll dice",
          "parameters": {}
        },
        {
          "text": "roll 2 6-sided dice",
          "parameters": {
            "count": 2,
            "sides": 6
          }
        }
      ],
      "parameters": [
        {
          "name": "sides",
          "description": "Number of sides on the dice",
          "extraction_patterns": [
            {
              "pattern": [
                {
                  "LIKE_NUM": true
                },
                {
                  "LOWER": {
                    "IN": [
                      "sided",
                      "sides"
                    ]
                  }
                }
              ],
              "label": "DICE_SIDES"
            }
          ],
          "aliases": [],
          "default_value": 6
        },
        {
          "name": "count",
          "description": "Number of dice to roll",
          "extraction_patterns": [
            {
              "pattern": [
                {
                  "LIKE_NUM": true
                },
                {
                  "LEMMA": {
                    "IN": [
                      "dice"
                    ]
                  }
                }
              ],
              "label": "DICE_COUNT"
            }
          ],
          "aliases": [],
          "default_value": 1
        }
      ]
    },
    {
      "method_name": "_handle_random_number",
      "intent_suffix": "number",
      "description": "Generate a random number within specified range",
      "phrases": [
        "random number",
        "generate number",
        "pick number",
        "number from"
      ],
      "lemmas": [],
      "token_patterns": [
        [
          {
            "TEXT": "random"
          },
          {
            "TEXT": "number"
          }
        ],
        [
          {
            "TEXT": "generate"
          },
          {
            "TEXT": "number"
          }
        ],
        [
          {
            "LOWER": "from"
          }
        ]
      ],
      "slot_patterns": {
        "MIN_VALUE": [
          [
            {
              "LOWER": "from"
            },
            {
              "LIKE_NUM": true
            }
          ],
          [
            {
              "LOWER": "from"
            },
            {
              "LIKE_NUM": true
            }
          ]
        ],
        "MAX_VALUE": [
          [
            {
              "LOWER": "until"
            },
            {
              "LIKE_NUM": true
            }
          ],
          [
            {
              "LOWER": "to"
            },
            {
              "LIKE_NUM": true
            }
          ]
        ]
      },
      "examples": [
        {
          "text": "random number",
          "parameters": {}
        },
        {
          "text": "number from 5 to 50",
          "parameters": {
            "min": 5,
            "max": 50
          }
        }
      ],
      "parameters": [
        {
          "name": "min",
          "description": "Minimum value for random number",
          "extraction_patterns": [
            {
              "pattern": [
                {
                  "LOWER": "from"
                },
                {
                  "LIKE_NUM": true
                }
              ],
              "label": "MIN_VALUE"
            },
            {
              "pattern": [
                {
                  "LOWER": "from"
                },
                {
                  "LIKE_NUM": true
                }
              ],
              "label": "MIN_VALUE"
            }
          ],
          "aliases": [
            "from"
          ],
          "default_value": 1
        },
        {
          "name": "max",
          "description": "Maximum value for random number",
          "extraction_patterns": [
            {
              "pattern": [
                {
                  "LOWER": "until"
                },
                {
                  "LIKE_NUM": true
                }
              ],
              "label": "MAX_VALUE"
            },
            {
              "pattern": [
                {
                  "LOWER": "to"
                },
                {
                  "LIKE_NUM": true
                }
              ],
              "label": "MAX_VALUE"
            }
          ],
          "aliases": [
            "to"
          ],
          "default_value": 100
        }
      ]
    },
    {
      "method_name": "_handle_random_choice",
      "intent_suffix": "choice",
      "description": "Choose randomly from a list of options",
      "phrases": [
        "random choice",
        "choose from",
        "pick from",
        "select from"
      ],
      "lemmas": [],
      "token_patterns": [
        [
          {
            "LOWER": "from"
          }
        ],
        [
          {
            "TEXT": "random"
          },
          {
            "TEXT": "choice"
          }
        ],
        [
          {
            "TEXT": {
              "REGEX": "choose|pick|select"
            }
          },
          {
            "TEXT": "from"
          }
        ]
      ],
      "slot_patterns": {
        "OPTIONS": [
          [
            {
              "LOWER": "from"
            },
            {
              "IS_ALPHA": true,
              "OP": "+"
            }
          ],
          [
            {
              "LOWER": "from"
            },
            {
              "IS_ALPHA": true,
              "OP": "+"
            }
          ]
        ]
      },
      "examples": [
        {
          "text": "choose from apple or orange",
          "parameters": {
            "options": "apple or orange"
          }
        }
      ],
      "parameters": [
        {
          "name": "options",
          "description": "List of options to choose from",
          "extraction_patterns": [
            {
              "pattern": [
                {
                  "LOWER": "from"
                },
                {
                  "IS_ALPHA": true,
                  "OP": "+"
                }
              ],
              "label": "OPTIONS"
            },
            {
              "pattern": [
                {
                  "LOWER": "from"
                },
                {
                  "IS_ALPHA": true,
                  "OP": "+"
                }
              ],
              "label": "OPTIONS"
            }
          ],
          "aliases": []
        }
      ]
    }
  ],
  "global_parameters": []
}
