{
  "$schema": "../../donation_language_v1.1.json",
  "schema_version": "1.1",
  "handler_domain": "greeting",
  "language": "ru",
  "description": "Приветствия и прощания с контекстно-зависимыми ответами",
  "action_patterns": [],
  "negative_patterns": [
    [
      {
        "LEMMA": {
          "IN": [
            "нет",
            "не"
          ]
        }
      },
      {
        "LEMMA": {
          "IN": [
            "привет",
            "пока"
          ]
        }
      }
    ],
    [
      {
        "TEXT": {
          "REGEX": ".*"
        }
      },
      {
        "TEXT": {
          "REGEX": ".*"
        }
      }
    ]
  ],
  "method_donations": [
    {
      "method_name": "_handle_greeting",
      "intent_suffix": "hello",
      "description": "Обработка приветствий и приветственных сообщений",
      "phrases": [
        "привет",
        "здравствуй",
        "здравствуйте",
        "добро пожаловать",
        "приветствую",
        "рада видеть",
        "доброе утро",
        "добрый день",
        "добрый вечер"
      ],
      "lemmas": [
        "привет",
        "здравствовать",
        "приветствовать",
        "добрый",
        "доброе",
        "утро",
        "день",
        "вечер"
      ],
      "token_patterns": [
        [
          {
            "LEMMA": {
              "IN": [
                "привет",
                "здравствовать",
                "приветствовать"
              ]
            }
          }
        ],
        [
          {
            "TEXT": {
              "REGEX": ".*"
            }
          }
        ],
        [
          {
            "LEMMA": "добрый"
          },
          {
            "LEMMA": {
              "IN": [
                "утро",
                "день",
                "вечер"
              ]
            }
          }
        ],
        [
          {
            "TEXT": "добрый"
          },
          {
            "TEXT": {
              "REGEX": ".*"
            }
          }
        ]
      ],
      "slot_patterns": {
        "TIME_OF_DAY": [
          [
            {
              "LEMMA": "добрый"
            },
            {
              "LEMMA": {
                "IN": [
                  "утро",
                  "день",
                  "вечер"
                ]
              }
            }
          ],
          [
            {
              "TEXT": "добрый"
            },
            {
              "TEXT": {
                "REGEX": ".*"
              }
            }
          ]
        ]
      },
      "examples": [
        {
          "text": "привет",
          "parameters": {}
        },
        {
          "text": "доброе утро",
          "parameters": {}
        }
      ],
      "parameters": [
        {
          "name": "time_of_day",
          "description": "Приветствие в зависимости от времени",
          "extraction_patterns": [
            {
              "pattern": [
                {
                  "LEMMA": {
                    "IN": [
                      "утро",
                      "день",
                      "вечер",
                      "ночь"
                    ]
                  }
                }
              ],
              "label": "TIME_OF_DAY"
            },
            {
              "pattern": [],
              "label": "TIME_OF_DAY"
            }
          ],
          "aliases": [
            "время"
          ],
          "choice_surfaces": {
            "morning": [
              "утро"
            ],
            "afternoon": [
              "день"
            ],
            "evening": [
              "вечер"
            ],
            "night": [
              "ночь"
            ]
          }
        }
      ]
    },
    {
      "method_name": "_handle_farewell",
      "intent_suffix": "goodbye",
      "description": "Обработка прощаний и прощальных сообщений",
      "phrases": [
        "пока",
        "до свидания",
        "прощай",
        "бывай",
        "до встречи",
        "всего доброго"
      ],
      "lemmas": [
        "пока",
        "прощать",
        "свидание",
        "встреча",
        "добрый"
      ],
      "token_patterns": [
        [
          {
            "LEMMA": {
              "IN": [
                "пока",
                "прощать"
              ]
            }
          }
        ],
        [
          {
            "TEXT": {
              "REGEX": ".*"
            }
          }
        ],
        [
          {
            "LEMMA": "до"
          },
          {
            "LEMMA": {
              "IN": [
                "свидание",
                "встреча"
              ]
            }
          }
        ],
        [
          {
            "TEXT": "see"
          },
          {
            "TEXT": "you"
          }
        ],
        [
          {
            "TEXT": "take"
          },
          {
            "TEXT": "care"
          }
        ]
      ],
      "slot_patterns": {
        "RETURN_TIME": [
          [
            {
              "LOWER": "до"
            },
            {
              "LEMMA": {
                "IN": [
                  "встреча",
                  "свидание"
                ]
              }
            }
          ],
          [
            {
              "TEXT": "see"
            },
            {
              "TEXT": "you"
            },
            {
              "TEXT": {
                "REGEX": ".*"
              }
            }
          ]
        ]
      },
      "examples": [
        {
          "text": "пока",
          "parameters": {}
        },
        {
          "text": "до свидания",
          "parameters": {}
        }
      ],
      "parameters": []
    },
    {
      "method_name": "_handle_welcome",
      "intent_suffix": "welcome",
      "description": "Handle welcome responses and acknowledgments",
      "phrases": [
        "добро пожаловать",
        "рад встрече",
        "приятно познакомиться"
      ],
      "lemmas": [
        "добро",
        "пожаловать",
        "рад",
        "встреча",
        "познакомиться"
      ],
      "token_patterns": [
        [
          {
            "LEMMA": "добро"
          },
          {
            "LEMMA": "пожаловать"
          }
        ],
        [
          {
            "TEXT": "welcome"
          }
        ],
        [
          {
            "TEXT": "nice"
          },
          {
            "TEXT": "to"
          },
          {
            "TEXT": "meet"
          }
        ],
        [
          {
            "TEXT": "pleased"
          },
          {
            "TEXT": "to"
          },
          {
            "TEXT": "meet"
          }
        ]
      ],
      "examples": [
        {
          "text": "добро пожаловать",
          "parameters": {}
        }
      ]
    }
  ],
  "global_parameters": []
}
