{
  "$schema": "../../donation_language_v1.1.json",
  "schema_version": "1.1",
  "handler_domain": "train_schedule",
  "language": "ru",
  "description": "Информация о расписании поездов и планирование маршрутов",
  "action_patterns": [],
  "negative_patterns": [
    [
      {
        "LEMMA": {
          "IN": [
            "нет",
            "не"
          ]
        }
      },
      {
        "LEMMA": "поезд"
      }
    ],
    [
      {
        "TEXT": {
          "REGEX": ".*"
        }
      },
      {
        "TEXT": "поезд"
      }
    ]
  ],
  "train_keywords": [
    "электричка",
    "электрички",
    "поезд",
    "ближайший поезд",
    "расписание поездов",
    "расписание электричек"
  ],
  "method_donations": [
    {
      "method_name": "handle_train_query",
      "intent_suffix": "query",
      "description": "Обработка запросов о расписании поездов и маршрутах",
      "phrases": [
        "расписание поездов",
        "когда поезд",
        "поезда до",
        "электричка до",
        "электричка",
        "электрички",
        "поезд",
        "ближайший поезд",
        "расписание электричек"
      ],
      "lemmas": [
        "расписание",
        "поезд",
        "электричка",
        "когда",
        "до"
      ],
      "token_patterns": [
        [
          {
            "LEMMA": "расписание"
          },
          {
            "LEMMA": "поезд"
          }
        ],
        [
          {
            "LEMMA": "когда"
          },
          {
            "LEMMA": "поезд"
          }
        ],
        [
          {
            "LEMMA": "поезд"
          },
          {
            "LEMMA": "до"
          }
        ],
        [
          {
            "TEXT": "поезд"
          },
          {}
        ],
        [
          {
            "TEXT": "when"
          },
          {
            "TEXT": "is"
          },
          {
            "TEXT": "поезд"
          }
        ]
      ],
      "slot_patterns": {
        "FROM_STATION": [
          [
            {
              "LOWER": {
                "IN": [
                  "от",
                  "из"
                ]
              }
            },
            {
              "IS_ALPHA": true,
              "OP": "+"
            }
          ],
          [
            {
              "LOWER": "от"
            },
            {
              "IS_ALPHA": true,
              "OP": "+"
            }
          ]
        ],
        "TO_STATION": [
          [
            {
              "LOWER": {
                "IN": [
                  "до",
                  "в"
                ]
              }
            },
            {
              "IS_ALPHA": true,
              "OP": "+"
            }
          ],
          [
            {
              "LOWER": "to"
            },
            {
              "IS_ALPHA": true,
              "OP": "+"
            }
          ]
        ],
        "TIME": [
          [
            {
              "TEXT": {
                "REGEX": ".*"
              }
            }
          ],
          [
            {
              "LOWER": {
                "IN": [
                  "утром",
                  "днем",
                  "вечером"
                ]
              }
            }
          ]
        ]
      },
      "examples": [
        {
          "text": "расписание поездов",
          "parameters": {}
        },
        {
          "text": "поезда до Москвы",
          "parameters": {
            "to_station": "Москвы"
          }
        },
        {
          "text": "когда поезд от Санкт-Петербурга до Москвы",
          "parameters": {
            "from_station": "Санкт-Петербурга",
            "to_station": "Москвы"
          }
        }
      ],
      "parameters": [
        {
          "name": "from_station",
          "description": "Станция отправления",
          "extraction_patterns": [
            {
              "pattern": [
                {
                  "LOWER": {
                    "IN": [
                      "от",
                      "из"
                    ]
                  }
                },
                {
                  "IS_ALPHA": true
                }
              ],
              "label": "FROM_STATION"
            }
          ],
          "aliases": [
            "откуда"
          ]
        },
        {
          "name": "to_station",
          "description": "Станция назначения",
          "extraction_patterns": [
            {
              "pattern": [
                {
                  "LOWER": {
                    "IN": [
                      "до",
                      "в"
                    ]
                  }
                },
                {
                  "IS_ALPHA": true
                }
              ],
              "label": "TO_STATION"
            }
          ],
          "aliases": [
            "куда"
          ]
        },
        {
          "name": "time",
          "description": "Время или дата отправления",
          "extraction_patterns": [
            {
              "pattern": [
                {
                  "TEXT": {
                    "REGEX": ".*"
                  }
                }
              ],
              "label": "время"
            },
            {
              "pattern": [
                {
                  "LOWER": {
                    "IN": [
                      "утром",
                      "днем",
                      "вечером"
                    ]
                  }
                }
              ],
              "label": "TIME_PERIOD"
            }
          ],
          "aliases": [
            "время",
            "когда"
          ]
        }
      ]
    }
  ],
  "global_parameters": [
    {
      "name": "language",
      "description": "Предпочтение языка ответа",
      "default_value": "ru",
      "choice_surfaces": {
        "ru": [
          "русский"
        ],
        "en": [
          "английский"
        ]
      }
    }
  ]
}
