{
  "$schema": "../../donation_language_v1.1.json",
  "schema_version": "1.1",
  "handler_domain": "translation",
  "language": "en",
  "description": "Text translation commands via LLM",
  "action_patterns": [
    "translate",
    "translation",
    "convert"
  ],
  "negative_patterns": [
    [
      {
        "LEMMA": {
          "IN": []
        }
      },
      {
        "LEMMA": {
          "IN": []
        }
      }
    ],
    [
      {
        "TEXT": {
          "REGEX": "no|not"
        }
      },
      {
        "TEXT": {
          "REGEX": "translate|translation"
        }
      }
    ]
  ],
  "method_donations": [
    {
      "method_name": "_handle_translate_text",
      "intent_suffix": "translate",
      "description": "Translate text using command parsing",
      "phrases": [
        "translate",
        "translation",
        "translate to",
        "make translation",
        "convert to"
      ],
      "lemmas": [],
      "token_patterns": [
        [
          {
            "TEXT": "translate"
          }
        ],
        [
          {
            "TEXT": "translation"
          }
        ],
        [
          {
            "IS_ALPHA": true,
            "OP": "+"
          }
        ],
        [
          {
            "TEXT": "translate"
          },
          {
            "IS_ALPHA": true,
            "OP": "+"
          }
        ]
      ],
      "slot_patterns": {
        "TEXT": [
          [
            {
              "LEMMA": "translate"
            },
            {
              "IS_ALPHA": true,
              "OP": "+"
            }
          ],
          [
            {
              "TEXT": "translate"
            },
            {
              "IS_ALPHA": true,
              "OP": "+"
            }
          ]
        ],
        "TARGET_LANGUAGE": [
          [
            {
              "TEXT": "on"
            },
            {
              "LOWER": {
                "IN": []
              }
            }
          ],
          [
            {
              "TEXT": "to"
            },
            {
              "LOWER": {
                "IN": [
                  "russian",
                  "english",
                  "spanish",
                  "french",
                  "german",
                  "chinese"
                ]
              }
            }
          ]
        ]
      },
      "examples": [
        {
          "text": "translate to russian",
          "parameters": {
            "target_language": "russian"
          }
        }
      ],
      "parameters": [
        {
          "name": "text",
          "description": "Text to translate (extracted from command)",
          "extraction_patterns": [
            {
              "pattern": [
                {
                  "IS_ALPHA": true,
                  "OP": "+"
                }
              ],
              "label": "TEXT"
            },
            {
              "pattern": [
                {
                  "TEXT": "translate"
                },
                {
                  "IS_ALPHA": true,
                  "OP": "+"
                }
              ],
              "label": "TEXT"
            }
          ],
          "aliases": []
        },
        {
          "name": "target_language",
          "description": "Target language for translation",
          "extraction_patterns": [
            {
              "pattern": [
                {
                  "TEXT": "on"
                }
              ],
              "label": "TARGET_LANGUAGE"
            },
            {
              "pattern": [
                {
                  "TEXT": "to"
                },
                {
                  "LOWER": {
                    "IN": [
                      "russian",
                      "english",
                      "spanish",
                      "french",
                      "german",
                      "chinese"
                    ]
                  }
                }
              ],
              "label": "TARGET_LANGUAGE"
            }
          ],
          "aliases": []
        }
      ]
    },
    {
      "method_name": "_handle_translate_specific",
      "intent_suffix": "specific",
      "description": "Translate specific text with extracted entities",
      "phrases": [
        "translate phrase",
        "translate word",
        "translate text to",
        "translate 'text' to",
        "make translation to"
      ],
      "lemmas": [],
      "token_patterns": [
        [
          {
            "TEXT": "on"
          }
        ],
        [
          {
            "TEXT": "translate"
          },
          {
            "TEXT": {
              "IN": [
                "phrase",
                "word",
                "text"
              ]
            }
          },
          {
            "TEXT": "to"
          }
        ],
        [
          {
            "TEXT": "'"
          },
          {
            "IS_ALPHA": true,
            "OP": "+"
          },
          {
            "TEXT": "'"
          }
        ],
        [
          {
            "TEXT": "translate"
          },
          {
            "TEXT": "'"
          },
          {
            "IS_ALPHA": true,
            "OP": "+"
          },
          {
            "TEXT": "'"
          }
        ],
        [
          {}
        ]
      ],
      "slot_patterns": {
        "TEXT": [
          [
            {
              "TEXT": "'"
            },
            {
              "IS_ALPHA": true,
              "OP": "+"
            },
            {
              "TEXT": "'"
            }
          ],
          [
            {
              "TEXT": "\""
            },
            {
              "IS_ALPHA": true,
              "OP": "+"
            },
            {
              "TEXT": "\""
            }
          ],
          [
            {
              "LEMMA": {
                "IN": []
              }
            },
            {
              "IS_ALPHA": true,
              "OP": "+"
            }
          ]
        ],
        "TARGET_LANGUAGE": [
          [
            {
              "TEXT": "on"
            },
            {
              "LOWER": {
                "IN": []
              }
            }
          ],
          [
            {
              "TEXT": "to"
            },
            {
              "LOWER": {
                "IN": [
                  "russian",
                  "english",
                  "spanish",
                  "french",
                  "german",
                  "chinese"
                ]
              }
            }
          ]
        ]
      },
      "examples": [],
      "parameters": [
        {
          "name": "text",
          "description": "Specific text to translate",
          "extraction_patterns": [
            {
              "pattern": [
                {
                  "TEXT": "'"
                },
                {
                  "IS_ALPHA": true,
                  "OP": "+"
                },
                {
                  "TEXT": "'"
                }
              ],
              "label": "TEXT"
            },
            {
              "pattern": [
                {
                  "TEXT": "\""
                },
                {
                  "IS_ALPHA": true,
                  "OP": "+"
                },
                {
                  "TEXT": "\""
                }
              ],
              "label": "TEXT"
            },
            {
              "pattern": [
                {
                  "IS_ALPHA": true,
                  "OP": "+"
                }
              ],
              "label": "TEXT"
            }
          ],
          "aliases": []
        },
        {
          "name": "target_language",
          "description": "Target language for specific translation",
          "extraction_patterns": [
            {
              "pattern": [
                {
                  "TEXT": "on"
                }
              ],
              "label": "TARGET_LANGUAGE"
            },
            {
              "pattern": [
                {
                  "TEXT": "to"
                },
                {
                  "LOWER": {
                    "IN": [
                      "russian",
                      "english",
                      "spanish",
                      "french",
                      "german",
                      "chinese"
                    ]
                  }
                }
              ],
              "label": "TARGET_LANGUAGE"
            }
          ],
          "aliases": []
        }
      ]
    }
  ],
  "global_parameters": [
    {
      "name": "language",
      "description": "Response language preference",
      "default_value": "ru"
    }
  ]
}
