{
  "$schema": "../../donation_language_v1.1.json",
  "schema_version": "1.1",
  "handler_domain": "greeting",
  "language": "en",
  "description": "Greeting and farewell interactions with context-aware responses",
  "action_patterns": [
    "hello",
    "goodbye",
    "welcome",
    "greet"
  ],
  "negative_patterns": [
    [
      {
        "LEMMA": {
          "IN": []
        }
      },
      {
        "LEMMA": {
          "IN": []
        }
      }
    ],
    [
      {
        "TEXT": {
          "REGEX": "no|not"
        }
      },
      {
        "TEXT": {
          "REGEX": "hello|goodbye"
        }
      }
    ]
  ],
  "method_donations": [
    {
      "method_name": "_handle_greeting",
      "intent_suffix": "hello",
      "description": "Handle hello and greeting messages",
      "phrases": [
        "hello",
        "hi",
        "hey",
        "greetings",
        "good morning",
        "good afternoon",
        "good evening",
        "how are you"
      ],
      "lemmas": [],
      "token_patterns": [
        [
          {
            "TEXT": {
              "REGEX": "hello|hi|hey"
            }
          }
        ],
        [
          {
            "TEXT": "good"
          },
          {
            "TEXT": {
              "REGEX": "morning|afternoon|evening"
            }
          }
        ]
      ],
      "slot_patterns": {
        "TIME_OF_DAY": [
          [
            {
              "LEMMA": "good"
            },
            {
              "LEMMA": {
                "IN": []
              }
            }
          ],
          [
            {
              "TEXT": "good"
            },
            {
              "TEXT": {
                "REGEX": "morning|afternoon|evening"
              }
            }
          ]
        ]
      },
      "examples": [
        {
          "text": "hello",
          "parameters": {}
        },
        {
          "text": "good evening",
          "parameters": {
            "time_of_day": "evening"
          }
        }
      ],
      "parameters": [
        {
          "name": "time_of_day",
          "description": "Time-specific greeting",
          "extraction_patterns": [
            {
              "pattern": [],
              "label": "TIME_OF_DAY"
            },
            {
              "pattern": [
                {
                  "LOWER": {
                    "IN": [
                      "morning",
                      "afternoon",
                      "evening",
                      "night"
                    ]
                  }
                }
              ],
              "label": "TIME_OF_DAY"
            }
          ],
          "aliases": [],
          "choice_surfaces": {
            "morning": [
              "morning"
            ],
            "afternoon": [
              "afternoon"
            ],
            "evening": [
              "evening"
            ],
            "night": [
              "night"
            ]
          }
        }
      ]
    },
    {
      "method_name": "_handle_farewell",
      "intent_suffix": "goodbye",
      "description": "Handle goodbye and farewell messages",
      "phrases": [
        "goodbye",
        "bye",
        "farewell",
        "see you",
        "take care",
        "good luck"
      ],
      "lemmas": [],
      "token_patterns": [
        [
          {
            "TEXT": {
              "REGEX": "goodbye|bye|farewell"
            }
          }
        ],
        [
          {
            "TEXT": "see"
          },
          {
            "TEXT": "you"
          }
        ],
        [
          {
            "TEXT": "take"
          },
          {
            "TEXT": "care"
          }
        ]
      ],
      "slot_patterns": {
        "RETURN_TIME": [
          [
            {
              "LOWER": "until"
            },
            {
              "LEMMA": {
                "IN": []
              }
            }
          ],
          [
            {
              "TEXT": "see"
            },
            {
              "TEXT": "you"
            },
            {
              "TEXT": {
                "REGEX": "later|soon|tomorrow"
              }
            }
          ]
        ]
      },
      "examples": [
        {
          "text": "goodbye",
          "parameters": {}
        },
        {
          "text": "see you later",
          "parameters": {}
        }
      ],
      "parameters": []
    },
    {
      "method_name": "_handle_welcome",
      "intent_suffix": "welcome",
      "description": "Handle welcome responses and acknowledgments",
      "phrases": [
        "welcome",
        "nice to meet you",
        "pleased to meet you",
        "glad to see you"
      ],
      "lemmas": [],
      "token_patterns": [
        [
          {
            "TEXT": "welcome"
          }
        ],
        [
          {
            "TEXT": "nice"
          },
          {
            "TEXT": "to"
          },
          {
            "TEXT": "meet"
          }
        ],
        [
          {
            "TEXT": "pleased"
          },
          {
            "TEXT": "to"
          },
          {
            "TEXT": "meet"
          }
        ]
      ],
      "examples": [
        {
          "text": "welcome",
          "parameters": {}
        },
        {
          "text": "nice to meet you",
          "parameters": {}
        }
      ]
    }
  ],
  "global_parameters": []
}
