{
  "$schema": "../../donation_language_v1.1.json",
  "schema_version": "1.1",
  "handler_domain": "datetime",
  "language": "ru",
  "description": "Запросы информации о дате и времени с поддержкой часовых поясов",
  "action_patterns": [],
  "additional_recognition_patterns": [
    "дата|какая дата|какое число|сегодня",
    "время|сколько времени|который час",
    "дата и время|время и дата"
  ],
  "negative_patterns": [
    [
      {
        "LEMMA": {
          "IN": [
            "нет",
            "не"
          ]
        }
      },
      {
        "LEMMA": {
          "IN": [
            "время",
            "дата"
          ]
        }
      }
    ],
    [
      {
        "TEXT": {
          "REGEX": ".*"
        }
      },
      {
        "TEXT": {
          "REGEX": ".*"
        }
      }
    ]
  ],
  "language_detection": {
    "english_indicators": [],
    "russian_indicators": [
      "время",
      "дата",
      "который",
      "какая",
      "сколько",
      "число"
    ]
  },
  "method_donations": [
    {
      "method_name": "_handle_time_request",
      "intent_suffix": "current_time",
      "description": "Получить текущую информацию о времени",
      "phrases": [
        "сколько времени",
        "который час",
        "время",
        "скажи время"
      ],
      "lemmas": [
        "время",
        "час",
        "сколько",
        "который",
        "сказать"
      ],
      "token_patterns": [
        [
          {
            "LEMMA": "сколько"
          },
          {
            "LEMMA": "время"
          }
        ],
        [
          {
            "LEMMA": "который"
          },
          {
            "LEMMA": "час"
          }
        ],
        [
          {
            "TEXT": "what"
          },
          {
            "TEXT": "время"
          }
        ],
        [
          {
            "TEXT": "current"
          },
          {
            "TEXT": "время"
          }
        ],
        [
          {
            "LEMMA": "сказать"
          },
          {
            "LEMMA": "время"
          }
        ]
      ],
      "slot_patterns": {
        "LOCATION": [
          [
            {
              "LOWER": "в"
            },
            {
              "IS_ALPHA": true,
              "OP": "+"
            }
          ],
          [
            {
              "LOWER": "по"
            },
            {
              "IS_ALPHA": true,
              "OP": "+"
            }
          ],
          [
            {
              "LOWER": "in"
            },
            {
              "IS_ALPHA": true,
              "OP": "+"
            }
          ]
        ],
        "TIME_FORMAT": [
          [
            {
              "TEXT": {
                "REGEX": ".*"
              }
            }
          ]
        ]
      },
      "examples": [
        {
          "text": "сколько времени",
          "parameters": {}
        },
        {
          "text": "который час",
          "parameters": {}
        },
        {
          "text": "время в Москве",
          "parameters": {}
        }
      ],
      "parameters": [
        {
          "name": "format",
          "description": "Time format preference",
          "extraction_patterns": [
            {
              "pattern": [
                {
                  "TEXT": {
                    "REGEX": ".*"
                  }
                }
              ],
              "label": "TIME_FORMAT"
            }
          ],
          "default_value": "verbose",
          "choice_surfaces": {
            "12hour": [
              "12 часов",
              "12-часовой",
              "двенадцатичасовой"
            ],
            "24hour": [
              "24 часа",
              "24-часовой",
              "двадцатичетырёхчасовой"
            ],
            "verbose": [
              "словами",
              "прописью",
              "подробно",
              "развёрнуто"
            ]
          }
        }
      ]
    },
    {
      "method_name": "_handle_date_request",
      "intent_suffix": "current_date",
      "description": "Get current date information",
      "phrases": [
        "какое число",
        "какая дата",
        "сегодня",
        "дата"
      ],
      "lemmas": [
        "число",
        "дата",
        "сегодня",
        "какой",
        "день"
      ],
      "token_patterns": [
        [
          {
            "LEMMA": "какой"
          },
          {
            "LEMMA": {
              "IN": [
                "число",
                "дата",
                "день"
              ]
            }
          }
        ],
        [
          {
            "LEMMA": "сегодня"
          }
        ],
        [
          {
            "TEXT": "what"
          },
          {
            "TEXT": {
              "REGEX": ".*"
            }
          }
        ],
        [
          {
            "TEXT": "сегодня"
          },
          {
            "TEXT": "дата"
          }
        ],
        [
          {
            "TEXT": "current"
          },
          {
            "TEXT": "дата"
          }
        ]
      ],
      "slot_patterns": {
        "DATE_FORMAT": [
          [
            {
              "TEXT": {
                "REGEX": ".*"
              }
            }
          ]
        ],
        "RELATIVE_DATE": [
          [
            {
              "LOWER": {
                "IN": [
                  "сегодня",
                  "завтра",
                  "вчера"
                ]
              }
            }
          ],
          [
            {
              "LOWER": {
                "IN": []
              }
            }
          ]
        ]
      },
      "examples": [
        {
          "text": "какое число",
          "parameters": {}
        },
        {
          "text": "какая дата сегодня",
          "parameters": {
            "relative": "сегодня"
          }
        }
      ],
      "parameters": [
        {
          "name": "format",
          "description": "Date format preference",
          "extraction_patterns": [
            {
              "pattern": [
                {
                  "TEXT": {
                    "REGEX": ".*"
                  }
                }
              ],
              "label": "DATE_FORMAT"
            }
          ],
          "default_value": "full",
          "choice_surfaces": {
            "short": [
              "кратко",
              "коротко",
              "цифрами",
              "сокращённо"
            ],
            "full": [
              "полная",
              "полностью",
              "полный"
            ],
            "iso": [
              "исо",
              "iso"
            ],
            "verbose": [
              "словами",
              "прописью",
              "подробно",
              "развёрнуто"
            ]
          }
        },
        {
          "name": "relative",
          "description": "Relative date reference",
          "extraction_patterns": [
            {
              "pattern": [
                {
                  "LOWER": {
                    "IN": [
                      "сегодня",
                      "завтра",
                      "вчера"
                    ]
                  }
                }
              ],
              "label": "RELATIVE_DATE"
            }
          ],
          "choice_surfaces": {
            "today": [
              "сегодня"
            ],
            "tomorrow": [
              "завтра"
            ],
            "yesterday": [
              "вчера"
            ]
          }
        }
      ]
    },
    {
      "method_name": "_handle_datetime_request",
      "intent_suffix": "current_datetime",
      "description": "Get combined date and time information",
      "phrases": [
        "дата и время",
        "полная дата",
        "время и дата"
      ],
      "lemmas": [
        "дата",
        "время",
        "полный"
      ],
      "token_patterns": [
        [
          {
            "LEMMA": "дата"
          },
          {
            "LEMMA": "время"
          }
        ],
        [
          {
            "LEMMA": "время"
          },
          {
            "LEMMA": "дата"
          }
        ],
        [
          {
            "TEXT": "дата"
          },
          {
            "TEXT": "and"
          },
          {
            "TEXT": "время"
          }
        ],
        [
          {
            "TEXT": "current"
          },
          {
            "TEXT": "datetime"
          }
        ],
        [
          {
            "LEMMA": "полный"
          },
          {
            "LEMMA": "дата"
          }
        ]
      ],
      "slot_patterns": {
        "TIMEZONE": [
          [
            {
              "TEXT": {
                "REGEX": ".*"
              }
            }
          ]
        ]
      },
      "examples": [
        {
          "text": "дата и время",
          "parameters": {}
        },
        {
          "text": "полная дата",
          "parameters": {}
        }
      ],
      "parameters": [
        {
          "name": "format",
          "description": "Datetime format preference",
          "default_value": "readable",
          "choice_surfaces": {
            "iso": [
              "исо",
              "iso"
            ],
            "readable": [
              "читаемый",
              "удобный",
              "человекочитаемый"
            ],
            "unix": [
              "юникс",
              "unix",
              "метка времени",
              "временная метка"
            ],
            "verbose": [
              "словами",
              "прописью",
              "подробно",
              "развёрнуто"
            ]
          }
        }
      ]
    }
  ],
  "global_parameters": []
}
