{
  "$schema": "../../donation_language_v1.1.json",
  "schema_version": "1.1",
  "handler_domain": "train_schedule",
  "language": "en",
  "description": "Train schedule information and route planning",
  "action_patterns": [
    "train_schedule",
    "get_trains"
  ],
  "negative_patterns": [
    [
      {
        "LEMMA": {
          "IN": []
        }
      },
      {
        "LEMMA": "train"
      }
    ],
    [
      {
        "TEXT": {
          "REGEX": "no|not"
        }
      },
      {
        "TEXT": "train"
      }
    ]
  ],
  "train_keywords": [],
  "method_donations": [
    {
      "method_name": "handle_train_query",
      "intent_suffix": "query",
      "description": "Handle train schedule and route queries",
      "phrases": [
        "train schedule",
        "when is train",
        "trains to",
        "railway timetable"
      ],
      "lemmas": [],
      "token_patterns": [
        [
          {
            "TEXT": "train"
          },
          {
            "TEXT": "schedule"
          }
        ],
        [
          {
            "TEXT": "when"
          },
          {
            "TEXT": "is"
          },
          {
            "TEXT": "train"
          }
        ]
      ],
      "slot_patterns": {
        "FROM_STATION": [
          [
            {
              "LOWER": {
                "IN": []
              }
            },
            {
              "IS_ALPHA": true,
              "OP": "+"
            }
          ],
          [
            {
              "LOWER": "from"
            },
            {
              "IS_ALPHA": true,
              "OP": "+"
            }
          ]
        ],
        "TO_STATION": [
          [
            {
              "LOWER": {
                "IN": []
              }
            },
            {
              "IS_ALPHA": true,
              "OP": "+"
            }
          ],
          [
            {
              "LOWER": "to"
            },
            {
              "IS_ALPHA": true,
              "OP": "+"
            }
          ]
        ],
        "TIME": [
          [
            {
              "TEXT": {
                "REGEX": "\\d{1,2}:\\d{2}"
              }
            }
          ],
          [
            {
              "LOWER": {
                "IN": [
                  "morning",
                  "afternoon",
                  "evening"
                ]
              }
            }
          ]
        ]
      },
      "examples": [
        {
          "text": "train schedule to London",
          "parameters": {
            "to_station": "London"
          }
        }
      ],
      "parameters": [
        {
          "name": "from_station",
          "description": "Departure station",
          "extraction_patterns": [
            {
              "pattern": [
                {
                  "LOWER": {
                    "IN": [
                      "from"
                    ]
                  }
                },
                {
                  "IS_ALPHA": true
                }
              ],
              "label": "FROM_STATION"
            }
          ],
          "aliases": [
            "departure"
          ]
        },
        {
          "name": "to_station",
          "description": "Destination station",
          "extraction_patterns": [
            {
              "pattern": [
                {
                  "LOWER": {
                    "IN": [
                      "to"
                    ]
                  }
                },
                {
                  "IS_ALPHA": true
                }
              ],
              "label": "TO_STATION"
            }
          ],
          "aliases": [
            "destination"
          ]
        },
        {
          "name": "time",
          "description": "Departure time or date",
          "extraction_patterns": [
            {
              "pattern": [
                {
                  "TEXT": {
                    "REGEX": "\\d{1,2}:\\d{2}"
                  }
                }
              ],
              "label": "TIME"
            },
            {
              "pattern": [
                {
                  "LOWER": {
                    "IN": [
                      "morning",
                      "afternoon",
                      "evening"
                    ]
                  }
                }
              ],
              "label": "TIME_PERIOD"
            }
          ],
          "aliases": []
        }
      ]
    }
  ],
  "global_parameters": [
    {
      "name": "language",
      "description": "Response language preference",
      "default_value": "ru"
    }
  ]
}
